{
  "schemaVersion": 1,
  "name": "subscription-card",
  "title": "SubscriptionCard",
  "category": "composition",
  "classification": "balsa-composition",
  "status": "beta",
  "version": "0.1.0",
  "purpose": "Plan, renewal, included usage, and management action.",
  "useFor": [
    "Production application interfaces",
    "Design Studio composition previews",
    "Reusable product workflows"
  ],
  "avoidFor": [
    "Decorative variant galleries",
    "Unrelated content forced into one surface",
    "Pinned geometry or elevation that bypasses the active theme"
  ],
  "variants": [
    "theme inherited"
  ],
  "sizes": [
    "responsive"
  ],
  "states": [
    "default",
    "interactive",
    "disabled where applicable"
  ],
  "composition": {
    "root": "ApplicationCard",
    "regions": [
      "header",
      "action",
      "body",
      "footer"
    ],
    "research": "https://docs.stripe.com/dashboard/basics"
  },
  "accessibility": [
    "Heading level follows the surrounding document hierarchy.",
    "Interactive controls retain native keyboard and focus behavior through Balsa primitives.",
    "Supporting text and status do not rely on color alone."
  ],
  "tokens": [
    "--balsa-color-surface",
    "--balsa-color-surface-foreground",
    "--balsa-color-muted",
    "--balsa-color-muted-foreground",
    "--balsa-color-border",
    "--balsa-radius-surface",
    "--balsa-border-width",
    "--balsa-border-opacity",
    "--balsa-shadow-surface",
    "--balsa-density-factor"
  ],
  "commonMistakes": [
    "Pinning radius, border, or shadow instead of inheriting the design context.",
    "Replacing the typed data contract with demo-only DOM.",
    "Adding a second principal card surface."
  ],
  "examples": [
    "Design Studio Grid",
    "Application dashboard"
  ],
  "publicApi": {
    "source": "src/components/compositions/SubscriptionCard.vue",
    "props": [
      {
        "name": "headingLevel",
        "type": "2 | 3 | 4 | 5 | 6 | undefined",
        "values": [
          "2",
          "3",
          "4",
          "5",
          "6"
        ],
        "required": false
      },
      {
        "name": "shadow",
        "type": "ThemeShadow | undefined",
        "values": [
          "md",
          "sm",
          "lg",
          "auto",
          "none"
        ],
        "required": false
      },
      {
        "name": "theme",
        "type": "ThemeInput | undefined",
        "shape": {
          "type": "ThemeDefinition",
          "fields": [
            {
              "name": "id",
              "type": "string",
              "required": true
            },
            {
              "name": "name",
              "type": "string",
              "required": true
            },
            {
              "name": "extends",
              "type": "\"modern-flat\" | \"brutalism\" | \"glassmorphism\" | ThemeDefinition",
              "required": true
            },
            {
              "name": "options",
              "type": "ThemeOptions | undefined",
              "required": false
            },
            {
              "name": "overrides",
              "type": "ThemeOverrides | undefined",
              "required": false
            },
            {
              "name": "tokens",
              "type": "ThemeTokens | undefined",
              "required": false
            },
            {
              "name": "defaults",
              "type": "ThemeDefaults | undefined",
              "required": false
            }
          ]
        },
        "required": false
      },
      {
        "name": "title",
        "type": "string | undefined",
        "values": [
          "string"
        ],
        "required": false,
        "default": "\"Subscription\""
      },
      {
        "name": "description",
        "type": "string | undefined",
        "values": [
          "string"
        ],
        "required": false,
        "default": "\"Workspace plan and included usage.\""
      },
      {
        "name": "plan",
        "type": "string | undefined",
        "values": [
          "string"
        ],
        "required": false,
        "default": "\"Pro\""
      },
      {
        "name": "price",
        "type": "string | undefined",
        "values": [
          "string"
        ],
        "required": false,
        "default": "\"$20 / member\""
      },
      {
        "name": "renewal",
        "type": "string | undefined",
        "values": [
          "string"
        ],
        "required": false,
        "default": "\"Renews Aug 31, 2026\""
      },
      {
        "name": "usage",
        "type": "number | undefined",
        "values": [
          "number"
        ],
        "required": false,
        "default": "64"
      }
    ],
    "events": [
      {
        "name": "manage",
        "type": "[]"
      }
    ],
    "slots": []
  }
}
